{
  "created_at": "2026-10-15T20:33:23.194Z",
  "items": [
    {
      "task": "m11-192"
    },
    {
      "task": "m11-191"
    },
    {
      "task": "m11-193"
    },
    {
      "task": "m11-196"
    },
    {
      "task": "m11-195"
    },
    {
      "task": "m11-184"
    },
    {
      "task": "m11-174"
    },
    {
      "task": "m11-131"
    },
    {
      "task": "m11-171"
    },
    {
      "task": "m11-172"
    },
    {
      "task": "m12-02"
    },
    {
      "task": "m11-133"
    },
    {
      "task": "m11-170"
    },
    {
      "task": "m11-88"
    },
    {
      "task": "m11-75"
    },
    {
      "task": "m11-176"
    },
    {
      "task": "m11-177"
    },
    {
      "task": "m11-139"
    },
    {
      "task": "m11-138"
    },
    {
      "task": "m12-31"
    },
    {
      "task": "m11-05"
    },
    {
      "task": "m11-173"
    },
    {
      "task": "m11-141"
    },
    {
      "task": "m11-144"
    },
    {
      "task": "m11-145"
    },
    {
      "task": "m11-160"
    },
    {
      "task": "m12-23"
    },
    {
      "task": "m12-21"
    },
    {
      "task": "m11-181"
    },
    {
      "task": "m11-178"
    },
    {
      "task": "m11-149"
    },
    {
      "task": "m11-150"
    },
    {
      "task": "m11-151"
    },
    {
      "task": "m11-153"
    },
    {
      "task": "m11-154"
    },
    {
      "task": "m11-167"
    },
    {
      "task": "m12-35"
    },
    {
      "task": "m12-36"
    },
    {
      "task": "m11-179"
    },
    {
      "task": "m11-186"
    },
    {
      "task": "m11-189"
    },
    {
      "task": "m12-38"
    },
    {
      "task": "m11-113"
    },
    {
      "task": "m11-180"
    },
    {
      "task": "m11-182"
    },
    {
      "task": "m11-183"
    },
    {
      "task": "m11-190"
    },
    {
      "task": "m11-161"
    },
    {
      "task": "m11-93"
    },
    {
      "task": "m11-194"
    },
    {
      "task": "m12-30"
    },
    {
      "task": "m12-33"
    },
    {
      "task": "m12-34"
    },
    {
      "task": "m10-19"
    },
    {
      "task": "m11-90"
    },
    {
      "task": "m12-24"
    },
    {
      "task": "m12-37"
    },
    {
      "task": "m12-32"
    },
    {
      "task": "m11-157"
    },
    {
      "task": "m11-158"
    },
    {
      "task": "m12-27"
    },
    {
      "task": "m12-25"
    },
    {
      "task": "m11-152"
    },
    {
      "task": "m11-142"
    },
    {
      "task": "m11-108"
    },
    {
      "task": "m11-162"
    },
    {
      "task": "m11-163"
    },
    {
      "task": "m11-59"
    },
    {
      "task": "m11-125"
    },
    {
      "task": "m11-80"
    },
    {
      "task": "m11-81"
    },
    {
      "task": "m11-82"
    },
    {
      "task": "m11-83"
    },
    {
      "task": "m11-84"
    },
    {
      "task": "m11-85"
    },
    {
      "task": "m11-86"
    },
    {
      "task": "m11-87"
    },
    {
      "task": "m10-24"
    }
  ],
  "order": 4,
  "title": "Revisión del 15 de octubre: ruta completa",
  "updated_at": "2026-10-15T20:33:24.321Z"
}
