{
  "created_at": "2026-10-14T17:21:25.843Z",
  "items": [
    {
      "result": "pass",
      "task": "m11-168"
    },
    {
      "result": "pass",
      "task": "m11-130"
    },
    {
      "result": "pass",
      "task": "m11-166"
    },
    {
      "result": "pass",
      "task": "m11-146"
    },
    {
      "result": "pass",
      "task": "m11-147"
    },
    {
      "result": "pass",
      "task": "m11-131"
    },
    {
      "result": "pass",
      "task": "m11-159"
    },
    {
      "result": "pass",
      "task": "m11-165"
    },
    {
      "task": "m11-29"
    },
    {
      "result": "pass",
      "task": "m12-29"
    },
    {
      "result": "pass",
      "task": "m11-132"
    },
    {
      "note": "Mejor, pero no tiene que haber x-ray cuando se levanta algo",
      "result": "fail",
      "task": "m11-133"
    },
    {
      "result": "pass",
      "task": "m11-135"
    },
    {
      "result": "pass",
      "task": "m11-164"
    },
    {
      "result": "pass",
      "task": "m11-136"
    },
    {
      "note": "la pared quebrada sigue el estilo pero no el ancho. La parte negra debería verse como la parte superior. Y la camara debería centrarse mas en lo visible de la sala, no en su posible tamaño completo como rectangulo",
      "result": "fail",
      "task": "m11-137"
    },
    {
      "result": "fail",
      "task": "m11-156"
    },
    {
      "note": "se ve horrendo y no soluciona el mismo problema del lado izquierdo",
      "result": "fail",
      "task": "m11-139"
    },
    {
      "task": "m11-138"
    },
    {
      "result": "pass",
      "task": "m11-155"
    },
    {
      "note": "necesita un poco de fine-tuning, por ahi invisibilidad por 2-4 frames al saltar y aterrizar",
      "result": "pass",
      "task": "m11-169"
    },
    {
      "task": "m11-141"
    },
    {
      "task": "m11-144"
    },
    {
      "task": "m11-145"
    },
    {
      "task": "m11-160"
    },
    {
      "task": "m12-23"
    },
    {
      "task": "m11-149"
    },
    {
      "task": "m11-150"
    },
    {
      "task": "m11-151"
    },
    {
      "task": "m11-153"
    },
    {
      "task": "m11-154"
    },
    {
      "task": "m11-167"
    },
    {
      "task": "m11-161"
    },
    {
      "task": "m11-162"
    },
    {
      "task": "m11-93"
    },
    {
      "task": "m11-152"
    },
    {
      "task": "m11-142"
    },
    {
      "task": "m11-158"
    },
    {
      "task": "m12-24"
    },
    {
      "task": "m12-21"
    },
    {
      "task": "m11-157"
    },
    {
      "task": "m12-25"
    },
    {
      "task": "m12-27"
    },
    {
      "task": "m10-19"
    },
    {
      "task": "m11-108"
    },
    {
      "task": "m11-88"
    },
    {
      "task": "m11-75"
    },
    {
      "task": "m11-80"
    },
    {
      "task": "m11-81"
    },
    {
      "task": "m11-82"
    },
    {
      "task": "m11-83"
    },
    {
      "task": "m11-84"
    },
    {
      "task": "m11-85"
    },
    {
      "task": "m11-86"
    },
    {
      "task": "m11-87"
    },
    {
      "task": "m10-23"
    },
    {
      "task": "m10-24"
    },
    {
      "task": "m11-171"
    },
    {
      "task": "m11-172"
    },
    {
      "task": "m11-173"
    },
    {
      "task": "m11-170"
    },
    {
      "task": "m11-174"
    }
  ],
  "order": 3,
  "title": "Revisión del 14 de octubre: overworld, mazmorras y sistemas",
  "updated_at": "2026-10-14T17:57:45.688Z"
}
